<?xml version="1.0" encoding="UTF-8"?>
<extension xmlns="http://ipt.gbif.org/extension/"
    xmlns:xsi="http://www.w3.org/2001/XMLSchema-instance"
    xsi:schemaLocation="http://ipt.gbif.org/extension/ http://gbrds.gbif.org/resources/schemas/extension.xsd" 
    title="Event Attribute" name="EventAttribute" namespace="http://rs.tdwg.org/dwc/terms/">
    <property name="EventAttributeID" namespace="http://rs.tdwg.org/dwc/terms/" qualName="http://rs.tdwg.org/dwc/terms/EventAttributeID" />
    <property name="EventAttributeType" namespace="http://rs.tdwg.org/dwc/terms/" qualName="http://rs.tdwg.org/dwc/terms/EventAttributeType" />
    <property name="EventAttributeValue" namespace="http://rs.tdwg.org/dwc/terms/" qualName="http://rs.tdwg.org/dwc/terms/EventAttributeValue" />
    <property name="EventAttributeAccuracy" namespace="http://rs.tdwg.org/dwc/terms/" qualName="http://rs.tdwg.org/dwc/terms/EventAttributeAccuracy" />
    <property name="EventAttributeUnit" namespace="http://rs.tdwg.org/dwc/terms/" qualName="http://rs.tdwg.org/dwc/terms/EventAttributeUnit" />
    <property name="EventAttributeDeterminedDate" namespace="http://rs.tdwg.org/dwc/terms/" qualName="http://rs.tdwg.org/dwc/terms/EventAttributeDeterminedDate" />
    <property name="EventAttributeDeterminedBy" namespace="http://rs.tdwg.org/dwc/terms/" qualName="http://rs.tdwg.org/dwc/terms/EventAttributeDeterminedBy" />
    <property name="EventAttributeRemarks" namespace="http://rs.tdwg.org/dwc/terms/" qualName="http://rs.tdwg.org/dwc/terms/EventAttributeRemarks" />
</extension>