<?xml version="1.0" encoding="UTF-8"?>
<extension xmlns="http://ipt.gbif.org/extension/"
    xmlns:xsi="http://www.w3.org/2001/XMLSchema-instance"
    xsi:schemaLocation="http://ipt.gbif.org/extension/ http://gbrds.gbif.org/resources/schemas/extension.xsd" 
    title="Related Resources" name="relation" namespace="http://purl.org/dc/terms/">
    <property name="abstract" namespace="http://purl.org/dc/terms/" qualName="http://purl.org/dc/terms/abstract"/>
    <property name="contributor" namespace="http://purl.org/dc/terms/" qualName="http://purl.org/dc/terms/contributor"/>
    <property name="coverage" namespace="http://purl.org/dc/terms/" qualName="http://purl.org/dc/terms/coverage"/>
    <property name="creator" namespace="http://purl.org/dc/terms/" qualName="http://purl.org/dc/terms/creator"/>
    <property name="created" namespace="http://purl.org/dc/terms/" qualName="http://purl.org/dc/terms/created"/>
    <property name="description" namespace="http://purl.org/dc/terms/" qualName="http://purl.org/dc/terms/description"/>
    <property name="format" namespace="http://purl.org/dc/terms/" qualName="http://purl.org/dc/terms/format"/>
    <property name="identifier" namespace="http://purl.org/dc/terms/" qualName="http://purl.org/dc/terms/identifier"/>
    <property name="issued" namespace="http://purl.org/dc/terms/" qualName="http://purl.org/dc/terms/issued"/>
    <property name="isVersionOf" namespace="http://purl.org/dc/terms/" qualName="http://purl.org/dc/terms/isVersionOf"/>
    <property name="language" namespace="http://purl.org/dc/terms/" qualName="http://purl.org/dc/terms/language"/>
    <property name="medium" namespace="http://purl.org/dc/terms/" qualName="http://purl.org/dc/terms/medium"/>
    <property name="modified" namespace="http://purl.org/dc/terms/" qualName="http://purl.org/dc/terms/modified"/>    
    <property name="publisher" namespace="http://purl.org/dc/terms/" qualName="http://purl.org/dc/terms/publisher"/>
    <property name="relation" namespace="http://purl.org/dc/terms/" qualName="http://purl.org/dc/terms/relation"/>
    <property name="rights" namespace="http://purl.org/dc/terms/" qualName="http://purl.org/dc/terms/rights"/>
    <property name="source" namespace="http://purl.org/dc/terms/" qualName="http://purl.org/dc/terms/source"/>
    <property name="spatial" namespace="http://purl.org/dc/terms/" qualName="http://purl.org/dc/terms/spatial"/>
    <property name="subject" namespace="http://purl.org/dc/terms/" qualName="http://purl.org/dc/terms/subject"/>
    <property name="temporal" namespace="http://purl.org/dc/terms/" qualName="http://purl.org/dc/terms/temporal"/>
    <property name="title" namespace="http://purl.org/dc/terms/" qualName="http://purl.org/dc/terms/title"/>
    <property name="type" namespace="http://purl.org/dc/terms/" qualName="http://purl.org/dc/terms/type"/>
        
</extension>